{
  "phase": "4.25",
  "verdict": "PASS",
  "entity_classes": {
    "citations": {
      "scanned": 5,
      "mismatch_count": 0
    },
    "institutions": {
      "scanned": 0,
      "mismatch_count": 0
    },
    "compound_identifiers": {
      "scanned": 6,
      "mismatch_count": 0
    },
    "regulatory_dates": {
      "scanned": 0,
      "mismatch_count": 0
    },
    "trial_registrations": {
      "scanned": 0,
      "mismatch_count": 0
    }
  },
  "halt_reasons": [],
  "iterations": 1,
  "timestamp": "2026-06-19T23:02:08.995002+00:00",
  "attestation_chain": {
    "iter_start_ts": "2026-06-19T23:00:33.067436+00:00",
    "attest_ts": "2026-06-19T23:02:08.995005+00:00",
    "iteration": 1,
    "agent_source_path": "sections/id-reconcile-source.md",
    "agent_source_sha256": "09d58932aee48f9e901fe9122d2615b21b149608df5a11f65e4c2ac5a2151bad",
    "agent_source_mtime": "2026-06-19T23:01:49.348631+00:00"
  }
}