{
  "phase": "4.25",
  "entity_classes": {
    "citations": {
      "scanned": 8,
      "mismatch_count": 0,
      "mismatches": []
    },
    "institutions": {
      "scanned": 4,
      "mismatch_count": 0,
      "mismatches": []
    },
    "compound_identifiers": {
      "scanned": 5,
      "mismatch_count": 0,
      "mismatches": []
    },
    "regulatory_dates": {
      "scanned": 3,
      "mismatch_count": 0,
      "mismatches": []
    },
    "trial_registrations": {
      "scanned": 5,
      "mismatch_count": 0,
      "mismatches": []
    }
  },
  "iterations": 2,
  "halt_reasons": [],
  "verdict": "PASS",
  "timestamp": "2026-06-19T13:16:01.869458+00:00",
  "attestation_chain": {
    "iter_start_ts": "2026-06-19T13:10:41.052646+00:00",
    "attest_ts": "2026-06-19T13:16:01.869462+00:00",
    "iteration": 2,
    "agent_source_path": "sections/id-reconcile-source.md",
    "agent_source_sha256": "b004db39ad2d0eb976bc8118bed42904701ba0f35e0bd5db416d61594b1780c4",
    "agent_source_mtime": "2026-06-19T13:15:11.844382+00:00"
  }
}