{
  "phase": "4.25",
  "verdict": "PASS",
  "iterations": 3,
  "entity_classes": {
    "citations": {
      "scanned": 28,
      "mismatch_count": 0,
      "mismatches": []
    },
    "institutions": {
      "scanned": 8,
      "mismatch_count": 0,
      "mismatches": []
    },
    "compound_identifiers": {
      "scanned": 12,
      "mismatch_count": 0,
      "mismatches": []
    },
    "regulatory_dates": {
      "scanned": 6,
      "mismatch_count": 0,
      "mismatches": []
    },
    "trial_registrations": {
      "scanned": 10,
      "mismatch_count": 0,
      "mismatches": []
    }
  },
  "halt_reasons": [],
  "timestamp": "2026-06-20T19:50:23.132061+00:00",
  "attestation_chain": {
    "iter_start_ts": "2026-06-20T19:44:15.507632+00:00",
    "attest_ts": "2026-06-20T19:50:23.132065+00:00",
    "iteration": 3,
    "agent_source_path": "sections/id-reconcile-source.md",
    "agent_source_sha256": "32f437732b95a606a6f892cef88fc5ea6bb8c0de6bb21b3647f085a288b6aae9",
    "agent_source_mtime": "2026-06-20T19:49:57.883754+00:00"
  }
}