{
  "phase": "4.25",
  "verdict": "PASS",
  "entity_classes": {
    "citations": {
      "scanned": 7,
      "mismatch_count": 0,
      "mismatches": []
    },
    "institutions": {
      "scanned": 3,
      "mismatch_count": 0,
      "mismatches": []
    },
    "compound_identifiers": {
      "scanned": 6,
      "mismatch_count": 0,
      "mismatches": []
    },
    "regulatory_dates": {
      "scanned": 4,
      "mismatch_count": 0,
      "mismatches": []
    },
    "trial_registrations": {
      "scanned": 0,
      "mismatch_count": 0,
      "mismatches": []
    }
  },
  "iterations": 1,
  "halt_reasons": [],
  "timestamp": "2026-06-20T22:55:31.086329+00:00",
  "attestation_chain": {
    "iter_start_ts": "2026-06-20T22:51:02.314054+00:00",
    "attest_ts": "2026-06-20T22:55:31.086332+00:00",
    "iteration": 1,
    "agent_source_path": "sections/id-reconcile-source.md",
    "agent_source_sha256": "a4b355bd93f7f4d39fcf1f120360b20aea6293fad9434a262f19e7082e6cbc15",
    "agent_source_mtime": "2026-06-20T22:52:32.243506+00:00"
  }
}